.offsite/E-MCM-text-corpus-work/artifacts/text-corpus/reading-runs/abstract-preview-20261030-v16/batches/000441.json

{
  "chunks": [
    {
      "end": 4219,
      "paper_id": "P-F-2024-2413565-15e84639",
      "paper_index": 426,
      "source_blocks": [
        {
          "block_id": "b000004",
          "end": 7,
          "pages": [
            1
          ],
          "section_id": "s0001",
          "start": 0
        },
        {
          "block_id": "b000007",
          "end": 22,
          "pages": [
            1
          ],
          "section_id": "s0002",
          "start": 9
        },
        {
          "block_id": "b000008",
          "end": 80,
          "pages": [
            1
          ],
          "section_id": "s0002",
          "start": 24
        },
        {
          "block_id": "b000009",
          "end": 180,
          "pages": [
            1
          ],
          "section_id": "s0002",
          "start": 82
        },
        {
          "block_id": "b000011",
          "end": 334,
          "pages": [
            1
          ],
          "section_id": "s0002",
          "start": 182
        },
        {
          "block_id": "b000012",
          "end": 1215,
          "pages": [
            1
          ],
          "section_id": "s0002",
          "start": 336
        },
        {
          "block_id": "b000013",
          "end": 1316,
          "pages": [
            1
          ],
          "section_id": "s0002",
          "start": 1217
        },
        {
          "block_id": "b000015",
          "end": 1782,
          "pages": [
            1
          ],
          "section_id": "s0002",
          "start": 1318
        },
        {
          "block_id": "b000016",
          "end": 2370,
          "pages": [
            1
          ],
          "section_id": "s0002",
          "start": 1784
        },
        {
          "block_id": "b000017",
          "end": 3077,
          "pages": [
            1
          ],
          "section_id": "s0002",
          "start": 2372
        },
        {
          "block_id": "b000018",
          "end": 3921,
          "pages": [
            1
          ],
          "section_id": "s0002",
          "start": 3079
        },
        {
          "block_id": "b000019",
          "end": 4217,
          "pages": [
            1
          ],
          "section_id": "s0002",
          "start": 3923
        }
      ],
      "start": 0,
      "status": "present-unverified",
      "text": "MCM/ICM\n\nSummary Sheet\n\nTechnique Innovations Terminating Illegal Wildlife Trade\n\nThe illegal wildlife trade does serious harm to global biodiversity and the balance of ecosystems,\n\nand we urgently need more people to get involved in stopping it. Finding suitable organizations and convincing them to participate is a great challenge.\n\nFirstly, we constructed the client triangle profile model based on three dimensions (power, resources, and interests), encompassed three categories of related clients: governments, enterprises, and non-governmental organizations (NGOs). We established this model to get the scores of each client with many indicators summarized for each dimension and then used the Entropy Weight Method (EWM) to get the corresponding weights. Some indicators and the corresponding weights are listed for samples as follows: country law (0.8967), industry influence (0.2248), or media platform promotion (0.4349) in the power dimension; GDP (0.8789), technological advancements (0.1283), or volunteer network (0.6878) in the resources dimension; crime rate reduction and public security (0.2540), optimizing reputation (0.1368), or biodiversity conservation (0.7460) in the interests dimen- sion.\n\nSecondly, we systematically evaluated the comprehensive scores of three different client categories\n\nfrom bottom to top by utilizing the Analytic Hierarchy Process (AHP) respectively. Then we calculated all the different potential client scores from 265 countries, 157 enterprises, and 30 organizations, and chose the client with the highest score. The famous luxury company, LVMH group, with the normalized client triangle profile (0.44, 0.94, 0.24) achieves the most potential score of 0.4157, and it is surprisingly an enterprise, neither a government nor a NGO.\n\nThirdly, we established a win-win model, innovatively introducing new revenue indicators such as penalty revenues and eradication of transactions (replaceable materials). As in the case of Apple Inc., discontinuing the use of leather products and adopting new materials has yielded more gains. We assessed the benefits that the project brings to our client through a\ufb00ine mapping analysis and estimated the additional profit value ($128.06 million) in a year for LVMH. We believe this project is ideally suitable for LVMH with its reputation for animal protection significantly enhanced.\n\nAdditionally, we\u2019ve devised a complementary vector model to evaluate the extra capabilities needed by clients during project execution. The resulting complementary vector of our client LVMH is (0.56, 0.06, 0.76), then we used the maximum matching model to identify the Seychelles govern- ment with profile data (0.35, 0.03, 0.46) from our previously evaluated potential clients which have the closest (99.9%) complementary vector based on cosine similarity. Our client LVMH may need some resources such as an exclusive economic zone of nearly 1.4 million square kilometers. LVMH can also benefit from the Seychelles government\u2019s support for wildlife protection policies, thereby enhancing its brand image.\n\nFinally, we established an impact model with the collected data on illegal wildlife trade from 2015 to 2022. We used multiple linear regression model based on the least squares method to compute measurable impact from factors such as medical trade, experimental trade, food trade, fur trade, and decoration trade, yielding coe\ufb00icients for the influencing vectors of (2.651, 0.812, 0.164, -0.147, -1.811). We can decrease the future five-year illegal wildlife trade value to $20 billion, assuming positive factors decrease by 10% annually and negative factors increase by 5%. The model resulted in a final predicted value of 17.54 billion, indicating a 33.81% decrease in trade volume. We utilized a weighted probability model based on the five-point estimation to assess the likelihood of project success, resulting in a probability of 87.2%.\n\nFurthermore, we put the wildlife trade within the larger ecological system and adapted the Leslie- Gower model as a fundamental framework to elucidate the dynamics of prey-predator interactions, the experiment results show the environmental protection factor will boost wildlife survival rates.\n\n",
      "total_characters": 4414,
      "whole_text_sha256": "f39ff73d0359c93e02f8d2f5aa70695aa1fbae84258d708aadac143474b876e0"
    }
  ],
  "completion_marker": "714192d2d4a78887c4d94a4279ce9c48683266d18772828b8467f3501eaa137c",
  "dataset_id": "7ccbf227d7b1409eae38fb9744f1d2a4fbc46c0b4e9ab7a0cc33224e78106f65",
  "finished": false,
  "from_cursor": {
    "char_offset": 0,
    "paper_index": 426
  },
  "preview": true,
  "run_id": "541d2520dc494e22a4ae952bd718d398",
  "sequence": 441,
  "to_cursor": {
    "char_offset": 4219,
    "paper_index": 426
  }
}

.offsite/E-MCM-text-corpus-work/artifacts/text-corpus/reflow-20261031-v48/papers/P-F-2024-2413565-15e84639/author.md

Firstly, we constructed the client triangle profile model based on three dimensions (power, resources, and interests), encompassed three categories of related clients: governments, enterprises, and non-governmental organizations (NGOs). We established this model to get the scores of each client with many indicators summarized for each dimension and then used the Entropy Weight Method (EWM) to get the corresponding weights. Some indicators and the corresponding weights are listed for samples as follows: country law (0.8967), industry influence (0.2248), or media platform promotion (0.4349) in the power dimension; GDP (0.8789), technological advancements (0.1283), or volunteer network (0.6878) in the resources dimension; crime rate reduction and public security (0.2540), optimizing reputation (0.1368), or biodiversity conservation (0.7460) in the interests dimen- sion.

Additionally, we’ve devised a complementary vector model to evaluate the extra capabilities needed by clients during project execution. The resulting complementary vector of our client LVMH is (0.56, 0.06, 0.76), then we used the maximum matching model to identify the Seychelles govern- ment with profile data (0.35, 0.03, 0.46) from our previously evaluated potential clients which have the closest (99.9%) complementary vector based on cosine similarity. Our client LVMH may need some resources such as an exclusive economic zone of nearly 1.4 million square kilometers. LVMH can also benefit from the Seychelles government’s support for wildlife protection policies, thereby enhancing its brand image.

In the previous section, we selected LVMH as our client. To enhance its capabilities at min- imal cost, we calculated its three-dimensional complementary vector, denoted as S, with values (0.56, 0.06, 0.76). Subsequently, employing the cosine similarity method, we computed the similarity between S and the three-dimensional vectors of all other potential clients, as illustrated in Figure 8. The most optimal match, in which cosine similarity reached an impressive 99.9%, was found to be (0.35, 0.03, 0.46). This vector corresponds to the government of Seychelles, a country in the western Indian Ocean.

• Fur Trade (-0.147): A negative coeﬀicient indicates a negative correlation with the target variable. Increasing fur trade may lead to a decrease in the target variable.

• Food Trade (0.164): Although the coeﬀicient is positive but relatively small, it suggests a slight positive impact on the target variable. Increasing food trade may slightly elevate the target variable.

• Medical Trade (0.812): A larger positive coeﬀicient implies a significant positive impact on the target variable. Increasing medical trade may notably enhance the target variable. 关注数学模型 • Decoration Trade (-1.811): A highly negative coeﬀicient indicates a substantial negative impact on the target variable. Increasing decoration trade may result in a sharp decline in the target variable.

• Experimental Trade (2.651): A highly positive coeﬀicient suggests a considerable positive impact on the target variable. Increasing experimental trade may lead to a significant increase in the target variable.